{
  "schema_version": 1,
  "updated_at": "2026-08-07T00:50:11Z",
  "registry_revision": "seed-2026-07-02",
  "packages": [
    {
      "id": {
        "owner": "abusch",
        "name": "nu_plugin_semver"
      },
      "description": "A Nushell plugin to manipulate SemVer versions: parse, compare, sort, bump, and match against version requirements. The catalog remains Windows-only pending intake and lifecycle evidence for the supported upstream Linux/macOS .tar.xz assets.",
      "repo": "https://github.com/abusch/nu_plugin_semver",
      "type": "plugin",
      "tags": [
        "plugin",
        "semver",
        "versioning",
        "windows-only"
      ],
      "versions": [
        {
          "version": "0.11.17",
          "nu_version": ">=0.113.0 <0.114.0",
          "verified_with": [
            "0.113.1"
          ],
          "artifact": {
            "kind": "binary",
            "targets": {
              "x86_64-pc-windows-msvc": {
                "url": "https://github.com/abusch/nu_plugin_semver/releases/download/v0.11.17/nu_plugin_semver-x86_64-pc-windows-msvc.zip",
                "sha256": "da33f99bc91eb741f5eea0f7a7d06f1478cd733989c877859858211658ed117c",
                "executable_path": "nu_plugin_semver.exe"
              }
            }
          }
        }
      ]
    },
    {
      "id": {
        "owner": "vyadh",
        "name": "nutest"
      },
      "description": "A Nushell test framework: discovers and runs @test-annotated commands with rich reporting and output capture. Commands are imported unprefixed (e.g. `run-tests`, not upstream's documented `nutest run-tests`): Numan's activation currently imports the mod.nu file directly rather than the containing directory, so Nu does not apply its directory-name-to-module-name convention here. v1.1.0 uses a registry-hosted mirror of upstream's tag archive; v1.2.0+ uses upstream's uploaded release assets for byte-stable hash pinning.",
      "repo": "https://github.com/vyadh/nutest",
      "type": "module",
      "tags": [
        "module",
        "testing"
      ],
      "versions": [
        {
          "version": "1.1.0",
          "nu_version": ">=0.103.0",
          "verified_with": [
            "0.113.1"
          ],
          "artifact": {
            "kind": "archive",
            "url": "https://github.com/tonythethompson/numan-registry/releases/download/mirror-vyadh-nutest-v1.1.0/nutest-1.1.0.zip",
            "sha256": "f33b4892509a7328bd3d8648ffe1cd5b4b541f2492783c9d9f3f81b5fd7c2c79",
            "entry": "nutest/mod.nu",
            "archive_root": "nutest-1.1.0"
          },
          "activation": {
            "kind": "nu-module",
            "import": "all"
          }
        },
        {
          "version": "1.2.0",
          "nu_version": ">=0.114.0",
          "verified_with": [
            "0.114.0"
          ],
          "artifact": {
            "kind": "archive",
            "url": "https://github.com/vyadh/nutest/releases/download/v1.2.0/nutest-1.2.0.zip",
            "sha256": "55d45a66cd2505f73df797c51a064b4d416a4500023afd356562c0d9b85322bb",
            "entry": "nutest/mod.nu",
            "archive_root": "nutest-1.2.0"
          },
          "activation": {
            "kind": "nu-module",
            "import": "all"
          }
        }
      ]
    },
    {
      "id": {
        "owner": "nushell-works",
        "name": "nu_plugin_nw_ulid"
      },
      "description": "Nushell plugin for ULID generation, parsing, and manipulation. Full cross-platform release assets in Numan-supported formats (.tar.gz and .zip).",
      "repo": "https://github.com/nushell-works/nu_plugin_nw_ulid",
      "type": "plugin",
      "tags": [
        "plugin",
        "ulid",
        "utility"
      ],
      "versions": [
        {
          "version": "0.2.0",
          "nu_version": ">=0.111.0 <0.112.0",
          "verified_with": [
            "0.111.0"
          ],
          "artifact": {
            "kind": "binary",
            "targets": {
              "aarch64-unknown-linux-gnu": {
                "url": "https://github.com/nushell-works/nu_plugin_nw_ulid/releases/download/v0.2.0/nu_plugin_nw_ulid-v0.2.0-linux-aarch64.tar.gz",
                "sha256": "732ce012c1f034c219b743bd03570be3a8fd76ac75234fc33181852898e2be9f",
                "executable_path": "nu_plugin_nw_ulid"
              },
              "x86_64-unknown-linux-gnu": {
                "url": "https://github.com/nushell-works/nu_plugin_nw_ulid/releases/download/v0.2.0/nu_plugin_nw_ulid-v0.2.0-linux-x86_64.tar.gz",
                "sha256": "877eaa8d245dff8f7450d6d55c4bd462dc8fea0659e267237226880104ae1c20",
                "executable_path": "nu_plugin_nw_ulid"
              },
              "aarch64-apple-darwin": {
                "url": "https://github.com/nushell-works/nu_plugin_nw_ulid/releases/download/v0.2.0/nu_plugin_nw_ulid-v0.2.0-macos-aarch64.tar.gz",
                "sha256": "6531604ede3b534daf8de9fadfca1716b14f7f50a66d9e7cff940ffc7df4a3fe",
                "executable_path": "nu_plugin_nw_ulid"
              },
              "x86_64-apple-darwin": {
                "url": "https://github.com/nushell-works/nu_plugin_nw_ulid/releases/download/v0.2.0/nu_plugin_nw_ulid-v0.2.0-macos-x86_64.tar.gz",
                "sha256": "a7c8d814581da11ee147f61674f1af68588885c20a7869da6639e9eb60da9b42",
                "executable_path": "nu_plugin_nw_ulid"
              },
              "x86_64-pc-windows-msvc": {
                "url": "https://github.com/nushell-works/nu_plugin_nw_ulid/releases/download/v0.2.0/nu_plugin_nw_ulid-v0.2.0-windows-x86_64.zip",
                "sha256": "ad31d02d87f4169f0a3755b76a565d4f7643ba059b17c6eb84c2a549da390240",
                "executable_path": "nu_plugin_nw_ulid.exe"
              }
            }
          }
        }
      ]
    },
    {
      "id": {
        "owner": "SuaveIV",
        "name": "nu_plugin_audio"
      },
      "description": "Nushell plugin for generating tones, reading/writing audio metadata, and playing audio files. Partial catalog support: Windows and Linux aarch64 only; supported upstream macOS and x86_64-linux .tar.xz targets are pending intake and lifecycle evidence.",
      "repo": "https://github.com/SuaveIV/nu_plugin_audio",
      "type": "plugin",
      "tags": [
        "plugin",
        "audio",
        "linux-aarch64-only",
        "partial-platform"
      ],
      "versions": [
        {
          "version": "0.2.8",
          "nu_version": ">=0.113.1 <0.114.0",
          "verified_with": [
            "0.113.1"
          ],
          "artifact": {
            "kind": "binary",
            "targets": {
              "x86_64-pc-windows-msvc": {
                "url": "https://github.com/SuaveIV/nu_plugin_audio/releases/download/v0.2.8/nu_plugin_audio-x86_64-pc-windows-msvc.zip",
                "sha256": "3e29d79d20700314f13c1a7984d43a34a2aa2b5b78f4c34e84b4d858b32ba7b2",
                "executable_path": "nu_plugin_audio.exe"
              },
              "aarch64-unknown-linux-gnu": {
                "url": "https://github.com/SuaveIV/nu_plugin_audio/releases/download/v0.2.8/nu_plugin_audio-v0.2.8-aarch64-unknown-linux-gnu.tar.gz",
                "sha256": "61b70acd249d71f8e87163f1be830628ad1342ae2ec180c36006f819207504f0",
                "executable_path": "nu_plugin_audio"
              }
            }
          }
        }
      ]
    },
    {
      "id": {
        "owner": "fdncred",
        "name": "nu_plugin_file"
      },
      "description": "Inspect a file and return information based on its magic number. CI-built from fdncred/nu_plugin_file@v0.26.0 and signed under the official trust root.",
      "repo": "https://github.com/fdncred/nu_plugin_file",
      "type": "plugin",
      "tags": [
        "plugin",
        "file",
        "filesystem",
        "ci-built"
      ],
      "versions": [
        {
          "version": "0.25.2",
          "nu_version": ">=0.113.0 <0.114.0",
          "verified_with": [
            "0.113.1"
          ],
          "artifact": {
            "kind": "binary",
            "targets": {
              "x86_64-pc-windows-msvc": {
                "url": "https://github.com/fdncred/nu_plugin_file/releases/download/v0.25.2/nu_plugin_file-x86_64-pc-windows-msvc.zip",
                "sha256": "a6908c1f895b291133969a256aa932b64cbac7ba1b8142716c767223aa8fc6b4",
                "executable_path": "nu_plugin_file.exe"
              },
              "aarch64-pc-windows-msvc": {
                "url": "https://github.com/fdncred/nu_plugin_file/releases/download/v0.25.2/nu_plugin_file-aarch64-pc-windows-msvc.zip",
                "sha256": "aea553a76fc7bdd30fe9d6f2d11876244ba29cca2690cbafe470563c32e9932a",
                "executable_path": "nu_plugin_file.exe"
              }
            }
          }
        },
        {
          "version": "0.26.0",
          "nu_version": ">=0.114.0 <0.115.0",
          "verified_with": [
            "0.114.1"
          ],
          "source": {
            "git": "https://github.com/fdncred/nu_plugin_file",
            "rev": "97efd18e8df8ea6e33d8c4b6b64c2fa717a647d6",
            "cargo_name": "nu_plugin_file"
          },
          "artifact": {
            "kind": "binary",
            "targets": {
              "aarch64-apple-darwin": {
                "url": "https://github.com/tonythethompson/numan-plugins/releases/download/nu_plugin_file-0.26.0/nu_plugin_file-0.26.0-aarch64-apple-darwin.tar.gz",
                "sha256": "6a5744831068e2f71e3acdba58bd2cc8d00cca85d8495f0fe6a394c77d49e123",
                "executable_path": "nu_plugin_file"
              },
              "aarch64-unknown-linux-gnu": {
                "url": "https://github.com/tonythethompson/numan-plugins/releases/download/nu_plugin_file-0.26.0/nu_plugin_file-0.26.0-aarch64-unknown-linux-gnu.tar.gz",
                "sha256": "b35dce641e4458a0b02486adf0492abce762811fefd8ce1b65f2930a5d804e30",